{
  "slug": "oferta-de-beca-en-el-centro-tecnologico-ai-nnovation-space",
  "title": "Oferta de Beca en el Centro Tecnológico AI.nnovation Space",
  "date": "2020-05-09T06:04:55+00:00",
  "modified": "2020-05-09T06:04:55+00:00",
  "author": "ajimenez",
  "categories": [
    "uncategorized"
  ],
  "tags": [],
  "readingTime": "1 minuto de lectura",
  "excerptHtml": "<p>El centro Tecnológico Mixto AI.nnovation Space oferta una beca para estudiante de dos meses de duración con fecha prevista de inicio el 1 de junio</p>",
  "contentHtml": "<p class=\"rtejustify\">El centro Tecnológico Mixto AI.nnovation Space oferta una beca para estudiante de dos meses de duración con fecha prevista de inicio el 1 de junio de 2020 para realizar tareas relacionadas con la creación de un gestor de terminología y un buscador de frases.</p>\n<p>Infornación adicional sobre la oferta de beca</p>\n<p style=\"text-align:center\"><img fetchpriority=\"high\" decoding=\"async\" class=\" size-full wp-image-138\" alt=\"\" height=\"842\" src=\"/assets/uploads/2020/05/CMixto-oferta_de_beca_01-06-20.pdf\" width=\"596\"></p>\n<p>&nbsp;</p>",
  "seo": {
    "title": "Oferta de Beca en el Centro Tecnológico AI.nnovation Space - Departamento de Inteligencia Artificial",
    "ogTitle": "Oferta de Beca en el Centro Tecnológico AI.nnovation Space - Departamento de Inteligencia Artificial",
    "ogType": "article",
    "image": "/assets/uploads/2020/05/CMixto-oferta_de_beca_01-06-20.pdf",
    "publishedTime": "2020-05-09T06:04:55+00:00",
    "robots": "index, follow, max-image-preview:large, max-snippet:-1, max-video-preview:-1"
  },
  "wpId": 139
}
