{
  "slug": "iacovid19-inteligencia-artificial-para-analizar-los-articulos-cientificos-relacionados-con-el-covid-19",
  "title": "IA&COVID19: Inteligencia Artificial para analizar los artículos científicos relacionados con el COVID-19",
  "date": "2020-03-30T10:16:48+00:00",
  "modified": "2020-03-30T10:16:48+00:00",
  "author": "ajimenez",
  "categories": [
    "uncategorized"
  ],
  "tags": [
    "noticias",
    "top-stories"
  ],
  "image": {
    "src": "/assets/uploads/2020/03/iainterior.jpg",
    "width": 701,
    "height": 400,
    "alt": "iainterior"
  },
  "thumbnail": {
    "src": "/assets/uploads/2020/03/iainterior-400x250.jpg",
    "width": 400,
    "height": 250,
    "alt": "iainterior"
  },
  "readingTime": "3 minutos de lectura",
  "excerptHtml": "<p class=\"rtejustify\">Desde el&nbsp;Ontology Engineering Group&nbsp;de la Escuela Técnica Superior de Ingenieros Informáticos de la Universidad Politécnica de Madrid lanzan esta iniciativa abierta para intentar dar a la comunidad científica y médica respuestas a algunas de sus preguntas a partir del análisis de la literatura científica que se ha publicado sobre el COVID-19.</p>",
  "contentHtml": "<p class=\"rtejustify\">Desde el&nbsp;Ontology Engineering Group&nbsp;de la Escuela Técnica Superior de Ingenieros Informáticos de la Universidad Politécnica de Madrid lanzan esta iniciativa abierta para intentar dar a la comunidad científica y médica respuestas a algunas de sus preguntas a partir del análisis de la literatura científica que se ha publicado sobre el COVID-19.</p>\n<p class=\"rtejustify\">Desde hace unas semanas, el&nbsp;Allen Institute for Artificial Intelligence&nbsp;mantiene&nbsp;<a href=\"https://pages.semanticscholar.org/coronavirus-research\">un corpus actualizado de artículos científicos sobre COVID-19</a>. A fecha de 27 de marzo de 2020, este corpus contiene más de 44.000 artículos en inglés, con el texto completo de más de 29.000 artículos.&nbsp;</p>\n<p class=\"rtejustify\">Esta ingente cantidad de literatura científica que se ha generado en apenas unos meses desde la aparición del virus, demuestra la gran actividad científica para su estudio. Pero al mismo tiempo, este corpus es tan grande que se ha convertido en un problema para que científicos y médicos puedan encontrar información específica sobre algún tipo de tratamiento que se haya probado en algún grupo específico de la población, relaciones entre tratamientos, resultados obtenidos, etc. Esto es lo que normalmente se conoce como sobrecarga de información.&nbsp;</p>\n<p class=\"rtejustify\">El 16 de marzo del 2020, la Oficina de Política Científica y Tecnológica de la Casa Blanca realizó un&nbsp;<a href=\"https://www.whitehouse.gov/briefings-statements/call-action-tech-community-new-machine-readable-covid-19-dataset/).\">llamamiento</a>&nbsp;a la comunidad internacional de Inteligencia Artificial para el desarrollo de técnicas de procesamiento de lenguaje natural y minería de textos que ayudaran a resolver preguntas que la comunidad científica se está realizando sobre el COVID-19. Muchas de estas preguntas, formuladas por médicos y científicos, están recogidas en la plataforma&nbsp;<a href=\"https://www.kaggle.com/allen-institute-for-ai/CORD-19-research-challenge/tasks\">Kaggle</a>, bien conocida por la comunidad de Ciencia de Datos e Inteligencia Artificial. A fecha de 27 de marzo, hay ya más de 400 iniciativas y contribuciones registradas, donde se han hecho distintos tipos de tratamientos de los textos que han sido proporcionados para responder a distintos grupos de preguntas.</p>\n<p class=\"rtejustify\">En el&nbsp;<a href=\"http://www.oeg-upm.net/\">Ontology Engineering Group</a>&nbsp;de la&nbsp;<a href=\"http://www.fi.upm.es/\">Escuela Técnica Superior de Ingenieros Informáticos&nbsp;</a>de la&nbsp;<a href=\"https://www.upm.es/\">Universidad Politécnica de Madrid</a>&nbsp;llevan trabajando varios años en el procesamiento de grandes corpus de textos, así que desde la semana pasada se han puesto a trabajar para intentar aportar su grano de arena en la solución de estos problemas, desarrollando el core de una tecnología que permita a otros investigadores, estudiantes e informáticos trabajar sobre ella. En la siguiente página describen lo que han hecho hasta ahora, y los recursos que ponen a disposición del resto de la comunidad científica, por si pudieran resultar útiles:&nbsp;<a href=\"https://oeg-upm.github.io/covid19/\">https://oeg-upm.github.io/covid19/</a></p>\n<p class=\"rtejustify\">Asimismo, hacen un llamamiento a todos aquellos que queráis colaborar en esta iniciativa abierta a toda la comunidad española en Inteligencia Artificial (investigadores, desarrolladores, estudiantes) con nuevas preguntas, con nuevos algoritmos que resuelvan algunas de las preguntas que la comunidad científica y médica se está realizando, con la validación de los resultados que han obtenido hasta ahora, con herramientas de visualización más amigable para los médicos, o con cualquier otra cosa que se os ocurra.&nbsp;Juntos podemos construir una plataforma con un conjunto de herramientas que puedan ser útiles para todos.</p>\n<p class=\"rtejustify\">No dudéis en contactarles a través del repositorio&nbsp;<a href=\"https://github.com/librairy/covid19\">https://github.com/librairy/covid19</a>&nbsp;(para desarrolladores) o directamente a su dirección de correo (moeg-covid19@delicias.dia.fi.upm.es).</p>",
  "seo": {
    "title": "IA&COVID19: Inteligencia Artificial para analizar los artículos científicos relacionados con el COVID-19 - Departamento de Inteligencia Artificial",
    "ogTitle": "IA&COVID19: Inteligencia Artificial para analizar los artículos científicos relacionados con el COVID-19 - Departamento de Inteligencia Artificial",
    "ogType": "article",
    "image": "/assets/uploads/2020/03/iainterior.jpg",
    "publishedTime": "2020-03-30T10:16:48+00:00",
    "robots": "index, follow, max-image-preview:large, max-snippet:-1, max-video-preview:-1"
  },
  "wpId": 131
}
