{
  "slug": "raul-garcia-castro-y-oscar-corcho-garcia-premio-articulo-cientifico-mas-citado-de-la-upm-2019",
  "title": "Raúl García Castro y Óscar Corcho García, Premio Artículo Científico más citado de la UPM 2019",
  "date": "2019-12-19T08:50:22+00:00",
  "modified": "2019-12-19T08:50:22+00:00",
  "author": "ajimenez",
  "categories": [
    "uncategorized"
  ],
  "tags": [
    "noticias",
    "top-stories"
  ],
  "image": {
    "src": "/assets/uploads/2019/12/OSCAR-Y-RAUL.png",
    "width": 638,
    "height": 418,
    "alt": "OSCAR Y RAUL"
  },
  "thumbnail": {
    "src": "/assets/uploads/2019/12/OSCAR-Y-RAUL-400x250.png",
    "width": 400,
    "height": 250,
    "alt": "OSCAR Y RAUL"
  },
  "readingTime": "1 minuto de lectura",
  "excerptHtml": "<p class=\"rtejustify\">Los profesores Raúl García Castro y&nbsp;Óscar Corcho García (profesor del Máster U. en Inteligencia Artificial) han obtenido el&nbsp;Premio Artículo Científico más citado de la Universidad Politécnica de Madrid 2019.</p>",
  "contentHtml": "<p class=\"rtejustify\">Los profesores Raúl García Castro y&nbsp;Óscar Corcho García (profesor del Máster U. en Inteligencia Artificial) han obtenido el&nbsp;Premio Artículo Científico más citado de la Universidad Politécnica de Madrid 2019.</p>\n<p class=\"rtejustify\">Los profesores Raúl García Castro y&nbsp;Óscar Corcho García (profesor del Máster U. en Inteligencia Artificial) y miembros del&nbsp;<a href=\"http://www.oeg-upm.net\" target=\"_blank\" rel=\"noopener\">Ontology&nbsp;Engineering Group</a>&nbsp;han obtenido el&nbsp;<strong>Premio Artículo Científico más citado</strong>&nbsp;de la Universidad Politécnica de Madrid 2019.</p>\n<p class=\"rtejustify\">Artículo premiado (actualmente <strong>1203 citas en google scholar</strong>):</p>\n<p class=\"rtejustify\">Michael Compton, Payam Barnaghi, Luis Bermudez, <strong>Raúl Garía-Castro, Óscar Corcho</strong>, Simon Cox, John Graybeal, Manfred Hauswirth,&nbsp;Cory Henson, Arthur Herzog, Vincent Huang, Krzysztof Janowiczj, W. David Kelsey, Danh Le Phuoc, Laurent Lefort, Myriam Leggieri, Holger Neuhaus, Andriy Nikolov, Kevin Pagem, Alexandre Passant, Amit Sheth, Kerry Taylor (2012):&nbsp;<a href=\"https://www.sciencedirect.com/science/article/pii/S1570826812000571\" target=\"_blank\" rel=\"noopener\">The SSN ontology of the W3C semantic sensor network incubator group</a>,&nbsp;<em>Journal of Web Semantics</em>&nbsp;<strong>17</strong>,&nbsp;25-32.</p>",
  "seo": {
    "title": "Raúl García Castro y Óscar Corcho García, Premio Artículo Científico más citado de la UPM 2019 - Departamento de Inteligencia Artificial",
    "ogTitle": "Raúl García Castro y Óscar Corcho García, Premio Artículo Científico más citado de la UPM 2019 - Departamento de Inteligencia Artificial",
    "ogType": "article",
    "image": "/assets/uploads/2019/12/OSCAR-Y-RAUL.png",
    "publishedTime": "2019-12-19T08:50:22+00:00",
    "robots": "index, follow, max-image-preview:large, max-snippet:-1, max-video-preview:-1"
  },
  "wpId": 123
}
