{
  "slug": "accenture-sl-premio-de-colaboracion-en-investigacion-e-innovacion-de-la-upm-2019",
  "title": "ACCENTURE SL, Premio de Colaboración en Investigación e Innovación de la UPM 2019",
  "date": "2019-12-19T09:02:00+00:00",
  "modified": "2019-12-19T09:02:00+00:00",
  "author": "ajimenez",
  "categories": [
    "uncategorized"
  ],
  "tags": [
    "noticias",
    "top-stories"
  ],
  "image": {
    "src": "/assets/uploads/2019/12/accent.png",
    "width": 824,
    "height": 244,
    "alt": "accent"
  },
  "thumbnail": {
    "src": "/assets/uploads/2019/12/accent.png",
    "width": 400,
    "height": 118,
    "alt": "accent"
  },
  "readingTime": "1 minuto de lectura",
  "excerptHtml": "<p class=\"rtejustify\">ACCENTURE SL ha recibido el&nbsp;Premio de Colaboración en Investigación e Innovación de la Universidad Politécnica de Madrid 2019.&nbsp;</p>\n<p class=\"rtejustify\">El premio reconoce a la persona física, entidad pública o privada de cualquier nacionalidad que más se haya destacado en la colaboración institucional en actividades de I+D+i&nbsp;con la Universidad Politécnica de Madrid.</p>",
  "contentHtml": "<p class=\"rtejustify\">ACCENTURE SL ha recibido el&nbsp;Premio de Colaboración en Investigación e Innovación de la Universidad Politécnica de Madrid 2019.&nbsp;</p>\n<p class=\"rtejustify\">El premio reconoce a la persona física, entidad pública o privada de cualquier nacionalidad que más se haya destacado en la colaboración institucional en actividades de I+D+i&nbsp;con la Universidad Politécnica de Madrid.</p>\n<p class=\"rtejustify\">ACCENTURE SL ha recibido el&nbsp;Premio de Colaboración en Investigación e Innovación de la Universidad Politécnica de Madrid 2019. El premio reconoce a la persona física, entidad pública o privada de cualquier nacionalidad que más se haya destacado en la colaboración institucional en actividades de I+D+i&nbsp;con la Universidad Politécnica de Madrid.</p>\n<p class=\"rtejustify\">Recogerá el premio D. Alfonso Tames Llana, Subdirector del <a href=\"https://www.ainnovation.upm.es\" target=\"_blank\" rel=\"noopener\">Centro Tecnológico Mixto UPM Accenture «AI.nnovation Space»</a> en Inteligencia Artificial.</p>",
  "seo": {
    "title": "ACCENTURE SL, Premio de Colaboración en Investigación e Innovación de la UPM 2019 - Departamento de Inteligencia Artificial",
    "ogTitle": "ACCENTURE SL, Premio de Colaboración en Investigación e Innovación de la UPM 2019 - Departamento de Inteligencia Artificial",
    "ogType": "article",
    "image": "/assets/uploads/2019/12/accent.png",
    "publishedTime": "2019-12-19T09:02:00+00:00",
    "robots": "index, follow, max-image-preview:large, max-snippet:-1, max-video-preview:-1"
  },
  "wpId": 125
}
