{
  "slug": "asuncion-gomez-perez-premio-nacional-de-informatica-aritmel",
  "title": "Asunción Gómez-Pérez, Premio Nacional de Informática Aritmel",
  "date": "2016-11-20T07:48:23+00:00",
  "modified": "2016-11-20T07:48:23+00:00",
  "author": "noticias",
  "categories": [
    "uncategorized"
  ],
  "tags": [
    "noticias",
    "top-stories"
  ],
  "image": {
    "src": "/assets/uploads/2016/11/asun_0.png",
    "width": 651,
    "height": 447,
    "alt": "asun"
  },
  "thumbnail": {
    "src": "/assets/uploads/2016/11/asun_0-400x250.png",
    "width": 400,
    "height": 250,
    "alt": "asun"
  },
  "readingTime": "3 minutos de lectura",
  "excerptHtml": "<h3 class=\"rtejustify\">Asunción Gómez Pérez, catedrática del DIA de la ETSI Informáticos de la UPM ha sido galardonada con el Premio Nacional de Informática Aritmel 2015, concedido por la <a href=\"http://www.scie.es/\">Sociedad Científica Informática</a>&nbsp;y entregado el pasado 14 de septiembre en el marco del <a href=\"http://www.congresocedi.es/es\">Congreso Español De Informática CEDI 2016</a>.&nbsp;El premio Aritmel se concede a aquel investigador, menor de 55 años, que haya realizado sobresalientes aportaciones científicas en el área de la ingeniería informática.</h3>",
  "contentHtml": "<h3 class=\"rtejustify\">Asunción Gómez Pérez, catedrática del DIA de la ETSI Informáticos de la UPM ha sido galardonada con el Premio Nacional de Informática Aritmel 2015, concedido por la <a href=\"http://www.scie.es/\">Sociedad Científica Informática</a>&nbsp;y entregado el pasado 14 de septiembre en el marco del <a href=\"http://www.congresocedi.es/es\">Congreso Español De Informática CEDI 2016</a>.&nbsp;El premio Aritmel se concede a aquel investigador, menor de 55 años, que haya realizado sobresalientes aportaciones científicas en el área de la ingeniería informática.</h3>\n<p>Asunción Gómez Pérez, catedrática del DIA de la ETSI Informáticos de la UPM ha sido galardonada con el Premio Nacional de Informática Aritmel 2015, concedido por la <a href=\"http://www.scie.es/\">Sociedad Científica Informática</a>&nbsp;y entregado el pasado 14 de septiembre en el marco del <a href=\"http://www.congresocedi.es/es\">Congreso Español De Informática CEDI 2016</a>.&nbsp;El premio Aritmel se concede a aquel investigador, menor de 55 años, que haya realizado sobresalientes aportaciones científicas en el área de la ingeniería informática. Esta distinción es un reconocimiento a sus sobresalientes aportaciones científicas a esta disciplina, centradas en el área de la Ingeniería Ontológica, la Web Semántica y los datos enlazados.&nbsp;</p>\n<p>Vicerrectora de Investigación, Innovación y Doctorado de la UPM, Asunción Gómez-Pérez dirige el <a href=\"http://www.oeg-upm.net/\">Grupo de Ingeniería Ontológica</a> de esta universidad. Considera el trabajo en equipo como uno de los pilares de su carrera, por lo que recibir este premio supone “un honor” además de un reconocimiento a la labor que desarrolla en el marco ese grupo de investigación. “Primamos la investigación en equipo frente a la individualidad”, asegura y destaca su intensa participación en competiciones nacionales e internacionales, hackatones y datathones con equipos multidisciplinares. “Todo ello nos ha permitido construir un ecosistema de investigación e innovación con diferentes grados de madurez” y mantener a la vez “una estrecha relación&nbsp;con el tejido universitario y empresarial nacional y europeo”, añade.</p>\n<p>Otro de los aspectos valorados por el jurado en la concesión de este premio es su participación en proyectos de investigación internacionales y el hecho de que sus artículos sean los que tienen un mayor índice de impacto de toda la UPM.</p>\n<p>La catedrática ha coordinado 5 proyectos europeos, y ha participado como investigador principal en 24 proyectos internacionales, la mayoría del quinto, sexto y séptimo Programa Marco. Ahora participa en tres proyectos del Programa H2020.</p>\n<p>Precisamente, esta apuesta por la internacionalización es otro de los sellos de identidad de la investigación de Asunción Gómez- Pérez desde que, al finalizar su licenciatura, realizase una estancia postdoctoral de un año en el Knowledgee System Laboratory de la Universidad de Stanford. “Las vivencias y las experiencias adquiridas en Stanford y en el entorno de Silicon Valley transformaron mi carrera profesional. Comprendí el reto intelectual que suponía investigar en la frontera del conocimiento, en un entorno muy competitivo y aprendí que para ser competitivos internacionalmente en investigación se requiere formación, ideas, capacidad, seriedad e intensidad en el trabajo y mucha financiación”, asegura.</p>\n<p>Entre los últimos hitos de su trayectoria, el jurado de los premios&nbsp;destaca &nbsp;su participación como investigadora principal en el primer proyecto que utiliza IBM-Watson en una Universidad española. Este proyecto está financiado por IBM USA y fue obtenido en una convocatoria del Shared University Research (SUR) Awards. Por otro lado, el Open Data Institute del Reino Unido, fundado por Tim Berners Lee, ha seleccionado al Ontology Engineering Group como sede del nodo en Madrid.</p>\n<p>Este reconocimiento a la figura de Asunción Gómez- Pérez se suma a otros como el Premio Ada Byron a la mujer tecnóloga 2015 y el Premio de Investigación UPM recibido este mismo año.</p>\n<p>En esta <a href=\"http://www.upm.es/Investigacion?id=3c710ee779147510VgnVCM10000009c7648a____&amp;prefmt=articulo&amp;fmt=detail\">entrevista</a>, Asunción Gómez&nbsp;repasa su carrera, analiza el estado de la investigación en nuestro país y en la universidad y esboza sus retos de futuro.</p>",
  "seo": {
    "title": "Asunción Gómez-Pérez, Premio Nacional de Informática Aritmel - Departamento de Inteligencia Artificial",
    "ogTitle": "Asunción Gómez-Pérez, Premio Nacional de Informática Aritmel - Departamento de Inteligencia Artificial",
    "ogType": "article",
    "image": "/assets/uploads/2016/11/asun_0.png",
    "publishedTime": "2016-11-20T07:48:23+00:00",
    "robots": "index, follow, max-image-preview:large, max-snippet:-1, max-video-preview:-1"
  },
  "wpId": 39
}
