{
  "slug": "premiocaepia",
  "title": "Un equipo formado por profesores de la ETSIINF recibe el segundo premio en la Conferencia de la Asociación Española para la Inteligencia Artificial",
  "date": "2021-09-28T07:56:13+00:00",
  "modified": "2023-08-18T16:37:57+00:00",
  "author": "dia_admin",
  "categories": [
    "uncategorized"
  ],
  "tags": [
    "noticias",
    "top-stories"
  ],
  "image": {
    "src": "/assets/uploads/2021/09/CAEPIA.png",
    "width": 512,
    "height": 512,
    "alt": "CAEPIA"
  },
  "thumbnail": {
    "src": "/assets/uploads/2021/09/CAEPIA-400x250.png",
    "width": 400,
    "height": 250,
    "alt": "CAEPIA"
  },
  "readingTime": "2 minutos de lectura",
  "excerptHtml": "<p>El artículo titulado «Analysing Ontological Requirements: A Journey from Requirements to Code and Back» ha recibido el segundo premio en la Conferencia de la Asociación</p>",
  "contentHtml": "<p>El artículo titulado «Analysing Ontological Requirements: A Journey from Requirements to Code and Back» ha recibido el segundo premio en la Conferencia de la Asociación Española para la Inteligencia Artificial celebrada en septiembre en Málaga.</p>\n<p>En este trabajo han participado dos profesores del&nbsp;<a href=\"/\">Departamento de Inteligencia Artificial</a>&nbsp;de la ETSIINF y miembros del OEG (<a href=\"http://www.upm.es/observatorio/vi/index.jsp?pageac=grupo.jsp&amp;idGrupo=323\">Grupo de Ingeniería Ontológica</a>), María Poveda-Villalón y Raúl García-Castro, junto a Alba Fernandez-Izquierdo, exmiembro del mismo grupo de investigación.</p>\n<p>El trabajo presentado en el artículo consiste en la anotación de 767 requisitos, procedentes de 10 ontologías, con patrones lexico-sintácticos los cuales están asociados a constructores de OWL (lenguaje de ontologías). A continuación se ha comparado ese conjunto de constructores esperados a partir de los requisitos con las implementaciones reales de las ontologías para analizar 1) qué partes de las ontologías se incluyen por decisión de los ingenieros ontológicos y 2) qué constructores se espera tener de acuerdo a los patrones pero realmente no aparecen en el código. Como conclusiones principales se puede decir que los requisitos se suelen escribir de forma poco precisa y en general cubren pocos constructores de manera que los ingenieros ontológicos tienen que tomar numerosas decisiones de diseño que no se derivan directamente de los requisitos.</p>\n<p>La&nbsp;<a href=\"https://caepia20-21.uma.es/\">Conferencia de la Asociación Española de Inteligencia Artificial&nbsp;</a>(CAEPIA) es un foro bienal abierto a investigadores de todo el mundo para presentar y discutir sus últimos avances científicos y tecnológicos en Inteligencia Artificial (I.A.).&nbsp;</p>\n<p>&nbsp;</p>\n<p><a href=\"https://www.fi.upm.es/?id=tablon&amp;acciongt=consulta1&amp;idet=4447\">Fuente</a></p>",
  "seo": {
    "title": "Un equipo formado por profesores de la ETSIINF recibe el segundo premio en la Conferencia de la Asociación Española para la Inteligencia Artificial - Departamento de Inteligencia Artificial",
    "ogTitle": "Un equipo formado por profesores de la ETSIINF recibe el segundo premio en la Conferencia de la Asociación Española para la Inteligencia Artificial - Departamento de Inteligencia Artificial",
    "ogType": "article",
    "image": "/assets/uploads/2021/09/CAEPIA.png",
    "publishedTime": "2021-09-28T07:56:13+00:00",
    "modifiedTime": "2023-08-18T16:37:57+00:00",
    "robots": "index, follow, max-image-preview:large, max-snippet:-1, max-video-preview:-1"
  },
  "wpId": 182
}
