{
  "slug": "pedro-larranaga-y-concha-bielza-premiados-por-la-amity-university-india",
  "title": "Pedro Larrañaga y Concha Bielza, premiados por la Amity University (India)",
  "date": "2020-01-31T12:17:54+00:00",
  "modified": "2020-01-31T12:17:54+00:00",
  "author": "dia_admin",
  "categories": [
    "uncategorized"
  ],
  "tags": [
    "noticias",
    "top",
    "top-stories"
  ],
  "image": {
    "src": "/assets/uploads/2020/01/India3.jpg",
    "width": 1040,
    "height": 780,
    "alt": "India3"
  },
  "thumbnail": {
    "src": "/assets/uploads/2020/01/India3-400x250.jpg",
    "width": 400,
    "height": 250,
    "alt": "India3"
  },
  "readingTime": "1 minuto de lectura",
  "excerptHtml": "<p class=\"rtejustify\">Los profesores del MUIA&nbsp;Pedro Larrañaga y Concha Bielza, reciben el Premio otorgado por Amity University, en Noida (India) por su relevante contribución investigadora en Machine Learning.</p>",
  "contentHtml": "<p class=\"rtejustify\">Los profesores del MUIA&nbsp;Pedro Larrañaga y Concha Bielza, reciben el Premio otorgado por Amity University, en Noida (India) por su relevante contribución investigadora en Machine Learning.</p>\n<p class=\"rtejustify\">\nLos catedráticos e investigadores de la ETSIINF, Pedro Larrañaga y Concha Bielza, han recibido &nbsp;el Premio «Amity Researcher Award for Significant Contribution in the Field of Machine Learning» en Confluence-2020: 10th International Conference on Cloud Computing, Data Science &amp; Engineering (<a href=\"https://www.amity.edu/aset/confluence2020/\">https://www.amity.edu/aset/confluence2020/</a>).&nbsp;Amity University en Noida (India) les ha hecho entrega de este Premio.</p>",
  "seo": {
    "title": "Pedro Larrañaga y Concha Bielza, premiados por la Amity University (India) - Departamento de Inteligencia Artificial",
    "ogTitle": "Pedro Larrañaga y Concha Bielza, premiados por la Amity University (India) - Departamento de Inteligencia Artificial",
    "ogType": "article",
    "image": "/assets/uploads/2020/01/India3.jpg",
    "publishedTime": "2020-01-31T12:17:54+00:00",
    "robots": "index, follow, max-image-preview:large, max-snippet:-1, max-video-preview:-1"
  },
  "wpId": 129
}
