{
  "slug": "la-catedratica-de-la-etsiinf-concha-bielza-ponente-en-los-seminarios-de-la-real-sociedad-matematica-espanola",
  "title": "La catedrática de la ETSIINF, Concha Bielza, ponente en los Seminarios de la Real Sociedad Matemática Española.",
  "date": "2021-05-05T10:32:37+00:00",
  "modified": "2023-08-18T16:37:57+00:00",
  "author": "dia_admin",
  "categories": [
    "uncategorized"
  ],
  "tags": [
    "noticias"
  ],
  "image": {
    "src": "/assets/uploads/2021/05/Concha-Bielza-Ayudas-Covid-BigData.jpg",
    "width": 1600,
    "height": 650,
    "alt": "Concha-Bielza-Ayudas-Covid-BigData"
  },
  "thumbnail": {
    "src": "/assets/uploads/2021/05/Concha-Bielza-Ayudas-Covid-BigData-400x250.jpg",
    "width": 400,
    "height": 250,
    "alt": "Concha-Bielza-Ayudas-Covid-BigData"
  },
  "readingTime": "2 minutos de lectura",
  "excerptHtml": "<p>El pasado 30 de abril de 2021 la catedrática Concha Bielza de la Universidad Politécnica de Madrid impartió la conferencia «Estadística y aprendizaje automático: Dos</p>",
  "contentHtml": "<p>El pasado 30 de abril de 2021 la catedrática Concha Bielza de la Universidad Politécnica de Madrid impartió la conferencia «Estadística y aprendizaje automático: Dos culturas para extraer conclusiones de los datos», invitada dentro de los Seminarios de la Real Sociedad Matemática Española.</p>\n<p>La estadística y el aprendizaje automático tienen como objetivo analizar datos para transformarlos en modelos computacionales de los que obtener conocimiento y predicciones. Ambas son disciplinas que han experimentado muchos cambios y son actualmente las tecnologías principales de la ciencia de datos. Se expusieron las diferencias, semejanzas y complementariedad, en aspectos tales como las hipótesis, selección y validación de modelos o la selección de subconjuntos de variables. Se puso especial énfasis en la interpretabilidad de los modelos para conseguir decisiones más confiables. Sirvieron de apoyo varios ejemplos principalmente de neurociencia.</p>\n<p>Los Seminarios RSME online son una iniciativa promovida por la RSME cuyo objetivo es ofrecer a la comunidad matemática una serie de conferencias sobre temas actuales de interés. Las conferencias se imparten por expertos en los respectivos ámbitos, con el propósito de motivar y dar a conocer los temas tratados para una audiencia matemática amplia, así como fomentar la visibilización de la actividad relevante realizada por investigadores nacionales, potenciando en la medida de lo posible la generación de sinergias entre grupos de investigación.</p>\n<p>Las conferencias se imparten online a través de la plataforma Google Meet el último viernes de cada mes, &nbsp;y quedan grabadas en el canal de Youtube de la RSME a disposición de toda la comunidad.</p>\n<p>Más información en:&nbsp;<a href=\"https://www.rsme.es/divulgacion-y-difusion/seminarios-rsme-online/\">https://www.rsme.es/divulgacion-y-difusion/seminarios-rsme-online/</a></p>",
  "seo": {
    "title": "La catedrática de la ETSIINF, Concha Bielza, ponente en los Seminarios de la Real Sociedad Matemática Española. - Departamento de Inteligencia Artificial",
    "ogTitle": "La catedrática de la ETSIINF, Concha Bielza, ponente en los Seminarios de la Real Sociedad Matemática Española. - Departamento de Inteligencia Artificial",
    "ogType": "article",
    "image": "/assets/uploads/2021/05/Concha-Bielza-Ayudas-Covid-BigData.jpg",
    "publishedTime": "2021-05-05T10:32:37+00:00",
    "modifiedTime": "2023-08-18T16:37:57+00:00",
    "robots": "index, follow, max-image-preview:large, max-snippet:-1, max-video-preview:-1"
  },
  "wpId": 172
}
