{
  "slug": "el-curso-de-verano-asdm-entre-los-6-mejores-cursos-de-estadistica-y-matematicas-por-inomics",
  "title": "El curso de verano ASDM, entre los 6 mejores cursos de Estadística y Matemáticas por INOMICS",
  "date": "2017-04-18T10:20:13+00:00",
  "modified": "2017-04-18T10:20:13+00:00",
  "author": "jcano",
  "categories": [
    "uncategorized"
  ],
  "tags": [
    "noticias",
    "top-stories"
  ],
  "image": {
    "src": "/assets/uploads/2017/04/inomics-badge-2017.png",
    "width": 2133,
    "height": 1233,
    "alt": "inomics-badge-2017"
  },
  "thumbnail": {
    "src": "/assets/uploads/2017/04/inomics-badge-2017-400x250.png",
    "width": 400,
    "height": 250,
    "alt": "inomics-badge-2017"
  },
  "readingTime": "1 minuto de lectura",
  "excerptHtml": "<p>El curso de verano «Advanced Statistics and Data Mining 2017» (ASDM2017) que anualmente organizan los profesores del departamento de Inteligencia Artificial, Pedro Larrañaga y Concha</p>",
  "contentHtml": "<h2 class=\"rtejustify\">El curso de verano «Advanced Statistics and Data Mining 2017» (ASDM2017) que anualmente organizan los profesores del departamento de Inteligencia Artificial, Pedro Larrañaga y Concha Bielza, ha sido seleccionado entre los 6 mejores cursos de Estadística y Matemáticas por la empresa alemana INOMICS. <a href=\"https://inomics.com/top-10-summer-schools-2017-math-stats\">Link</a></h2>",
  "seo": {
    "title": "El curso de verano ASDM, entre los 6 mejores cursos de Estadística y Matemáticas por INOMICS - Departamento de Inteligencia Artificial",
    "ogTitle": "El curso de verano ASDM, entre los 6 mejores cursos de Estadística y Matemáticas por INOMICS - Departamento de Inteligencia Artificial",
    "ogType": "article",
    "image": "/assets/uploads/2017/04/inomics-badge-2017.png",
    "publishedTime": "2017-04-18T10:20:13+00:00",
    "robots": "index, follow, max-image-preview:large, max-snippet:-1, max-video-preview:-1"
  },
  "wpId": 51
}
