{
  "slug": "concha-bielza-nombrada-miembro-del-consejo-cientifico-asesor-del-norwai",
  "title": "Concha Bielza nombrada Miembro del Consejo Científico Asesor del NorwAI",
  "date": "2021-05-31T07:56:53+00:00",
  "modified": "2023-08-18T16:37:57+00:00",
  "author": "dia_admin",
  "categories": [
    "uncategorized"
  ],
  "tags": [
    "noticias",
    "top-stories"
  ],
  "image": {
    "src": "/assets/uploads/2021/05/31652A73-FBFA-47DC-9045-E90F7F09AA36.jpeg",
    "width": 1706,
    "height": 960,
    "alt": "31652A73-FBFA-47DC-9045-E90F7F09AA36"
  },
  "thumbnail": {
    "src": "/assets/uploads/2021/05/31652A73-FBFA-47DC-9045-E90F7F09AA36-400x250.jpeg",
    "width": 400,
    "height": 250,
    "alt": "31652A73-FBFA-47DC-9045-E90F7F09AA36"
  },
  "readingTime": "1 minuto de lectura",
  "excerptHtml": "<p>Conchas Bielza ha sido nombrada Miembro del Consejo Científico Asesor del Norwegian Research Center for AI Innovation (NorwAI)&nbsp;pertenenciente a la Norwegian University of Science and</p>",
  "contentHtml": "<p>\nConchas Bielza ha sido nombrada Miembro del Consejo Científico Asesor del Norwegian Research Center for AI Innovation (NorwAI)&nbsp;pertenenciente a la Norwegian University of Science and Technology (Noruega). El centro coordina actividades de investigación, desarrollo e innovación de varias universidades, centros de investigación y prestigiosas compañías, con el objetivo de promover y potenciar la economía de los países escandinavos.</p>\n<p>Más información en:&nbsp;https://www.ntnu.edu/norwai</p>",
  "seo": {
    "title": "Concha Bielza nombrada Miembro del Consejo Científico Asesor del NorwAI - Departamento de Inteligencia Artificial",
    "ogTitle": "Concha Bielza nombrada Miembro del Consejo Científico Asesor del NorwAI - Departamento de Inteligencia Artificial",
    "ogType": "article",
    "image": "/assets/uploads/2021/05/31652A73-FBFA-47DC-9045-E90F7F09AA36.jpeg",
    "publishedTime": "2021-05-31T07:56:53+00:00",
    "modifiedTime": "2023-08-18T16:37:57+00:00",
    "robots": "index, follow, max-image-preview:large, max-snippet:-1, max-video-preview:-1"
  },
  "wpId": 176
}
