{
  "slug": "el-proyecto-europeo-stars4all-participa-en-el-finde-cientifico-junto-a-la-ucc-de-la-upm",
  "title": "El Proyecto Europeo STARS4ALL participa en el Finde Científico junto a la UCC de la UPM",
  "date": "2017-06-01T14:06:19+00:00",
  "modified": "2017-06-01T14:06:19+00:00",
  "author": "jcano",
  "categories": [
    "uncategorized"
  ],
  "tags": [
    "noticias",
    "top-stories"
  ],
  "image": {
    "src": "/assets/uploads/2017/06/Finde-Cientifico-Entrada.png",
    "width": 1024,
    "height": 809,
    "alt": "Finde Científico Entrada"
  },
  "thumbnail": {
    "src": "/assets/uploads/2017/06/Finde-Cientifico-Entrada-400x250.png",
    "width": 400,
    "height": 250,
    "alt": "Finde Científico Entrada"
  },
  "readingTime": "2 minutos de lectura",
  "excerptHtml": "<h3 class=\"rtejustify\">El Ontology Engineering Group (OEG) es el coordinador del proyecto, en el que también participan instituciones como la Universidad Complutense, la Universidad de Southampton, el Politecnico de Milano o el Instituto de Astrofísica de Canarias.</h3>",
  "contentHtml": "<h3 class=\"rtejustify\">El Ontology Engineering Group (OEG) es el coordinador del proyecto, en el que también participan instituciones como la Universidad Complutense, la Universidad de Southampton, el Politecnico de Milano o el Instituto de Astrofísica de Canarias.</h3>\n<p class=\"rtejustify\">Los pasados 27 y 28 de mayo, el Museo Nacional de Ciencia y Tecnología (<a href=\"http://www.muncyt.es/\">MUNCYT</a>) se volvió a convertir en el anfitrión del Finde Científico, un encuentro organizado por la Fundación Española para la Ciencia y la Tecnología (<a href=\"https://www.fecyt.es/\">FECYT</a>), que este año alcanza su VIII edición acercando la ciencia a todos los públicos a través de numerosas actividades, experiencias y prácticas que unen a profesores, alumnos, investigadores, científicos y público en general.</p>\n<p class=\"rtejustify\">En la presente edición, el stand de la Universidad Politécnica de Madrid (<a href=\"http://upm.es/UPM?id=5165ce803b85c510VgnVCM10000009c7648a____&amp;prefmt=articulo&amp;fmt=detail\">UPM</a>) contó con la presencia del Proyecto Europeo <a href=\"http://www.stars4all.eu\">STARS4ALL</a>. El marco de ciencia ciudadana de este proyecto europeo sirvió para desarrollar una serie de experiencias que ayudaron a los investigadores –del OEG y de la Facultad de Físicas de la UCM– a explicar a los asistentes qué es la contaminación lumínica, y qué efecto produce, en los cielos nocturnos, el exceso de iluminación en las ciudades. Se diseñaron varias actividades pensadas e implementadas para todas las edades: un proyector de estrellas y distintos tipos de iluminación en un espacio oscuro, una maqueta para mostrar qué es y cómo se puede evitar la intrusión lumínica en el hogar, y un espectrógrafo para enseñar a diferenciar el color y la intensidad de la iluminación. Un buen reclamo para acercar la ciencia a los asistentes y demostrar que la ciencia ciudadana es necesaria para el buen desarrollo de numerosos trabajos de investigación.</p>\n<p class=\"rtejustify\">En ese entorno, se presentaron las aplicaciones <a href=\"http://cazasteroides.org/es/\">Cazasteroides</a> y <a href=\"http://games.stars4all.eu/nightknights/#/home\">Night Knights</a>, dos juegos que ayudan a identificar y clasificar imágenes obtenidas de la Estación Espacial Internacional (ISS) y de telescopios profesionales, para convertir el juego en datos para la investigación. Datos abiertos y ciencia ciudadana se unieron en una jornada lúdica que ha servido para acercar la ciencia a todos los públicos y demostrar no sólo que es divertida, sino que a través de las plataformas y actividades adecuadas todo el mundo puede hacer ciencia ciudadana.</p>",
  "seo": {
    "title": "El Proyecto Europeo STARS4ALL participa en el Finde Científico junto a la UCC de la UPM - Departamento de Inteligencia Artificial",
    "ogTitle": "El Proyecto Europeo STARS4ALL participa en el Finde Científico junto a la UCC de la UPM - Departamento de Inteligencia Artificial",
    "ogType": "article",
    "image": "/assets/uploads/2017/06/Finde-Cientifico-Entrada-1024x809.png",
    "publishedTime": "2017-06-01T14:06:19+00:00",
    "robots": "index, follow, max-image-preview:large, max-snippet:-1, max-video-preview:-1"
  },
  "wpId": 53
}
