{
  "slug": "asuncion-gomez-perez-recibe-el-premio-a-la-trayectoria-divulgativa-ejemplar-2018",
  "title": "Asunción Gómez Pérez recibe el premio a la Trayectoria Divulgativa Ejemplar 2018",
  "date": "2019-04-29T15:47:08+00:00",
  "modified": "2019-04-29T15:47:08+00:00",
  "author": "ajimenez",
  "categories": [
    "uncategorized"
  ],
  "tags": [
    "noticias",
    "top-stories"
  ],
  "image": {
    "src": "/assets/uploads/2019/04/Premiados-Know-Square-2019.jpeg",
    "width": 1599,
    "height": 758,
    "alt": "Premiados Know Square 2019"
  },
  "thumbnail": {
    "src": "/assets/uploads/2019/04/Premiados-Know-Square-2019-400x250.jpeg",
    "width": 400,
    "height": 250,
    "alt": "Premiados Know Square 2019"
  },
  "readingTime": "3 minutos de lectura",
  "excerptHtml": "<p class=\"rtejustify\">El pasado miércoles, 24 de abril,&nbsp;se entregaron en el Museo Lázaro Galdiano los premios Know Square 2018 al Mejor Libro de Empresa, que recayó en Factfulness de Hans Rosling, e igualmente se entregaron los premios a la Trayectoria Divulgativa Ejemplar 2018, que recibieron Asunción Gómez Pérez (Vicerrectora de Investigación, Innovación y Doctorado&nbsp;de la UPM, y&nbsp;profesora del MUIA)&nbsp;y Ramón López de Mántaras (Director de Institut d’Invetigació en Intel-ligència Artificial del CSIC).</p>\n<p class=\"rtejustify\">En el acto&nbsp;también hubo&nbsp;una breve mesa de debate en la que participaron los premiados&nbsp;y D. Emilio Lamo Espinosa, presidente del Real Instituto Elcano.</p>",
  "contentHtml": "<p class=\"rtejustify\">El pasado miércoles, 24 de abril,&nbsp;se entregaron en el Museo Lázaro Galdiano los premios Know Square 2018 al Mejor Libro de Empresa, que recayó en Factfulness de Hans Rosling, e igualmente se entregaron los premios a la Trayectoria Divulgativa Ejemplar 2018, que recibieron Asunción Gómez Pérez (Vicerrectora de Investigación, Innovación y Doctorado&nbsp;de la UPM, y&nbsp;profesora del MUIA)&nbsp;y Ramón López de Mántaras (Director de Institut d’Invetigació en Intel-ligència Artificial del CSIC).</p>\n<p class=\"rtejustify\">En el acto&nbsp;también hubo&nbsp;una breve mesa de debate en la que participaron los premiados&nbsp;y D. Emilio Lamo Espinosa, presidente del Real Instituto Elcano.</p>\n<p class=\"rtejustify\">El pasado miércoles, 24 de abril,&nbsp;se entregaron en el Museo Lázaro Galdiano los premios Know Square 2018 al Mejor Libro de Empresa, que recayó en Factfulness de Hans Rosling, e igualmente se entregaron los premios a la Trayectoria Divulgativa Ejemplar 2018, que recibieron Asunción Gómez Pérez (profesora del MUIA)&nbsp;y Ramón López de Mántaras (Director de Institut d’Invetigació en Intel-ligència Artificial del CSIC).</p>\n<p class=\"rtejustify\">El enlace al evento:&nbsp;<a href=\"https://www.youtube.com/watch?v=wP2I8Z2jzOY&amp;list=PLEBBUkE6ZAznhtVvB31v5GOVKp_Z9nVi4\">https://www.youtube.com/watch?v=wP2I8Z2jzOY&amp;list=PLEBBUkE6ZAznhtVvB31v5GOVKp_Z9nVi4</a>&nbsp;</p>\n<p class=\"rtejustify\">(A partir del minuto 56:30 es cuando comienza la parte de la entrega del premio y la mesa debate).</p>\n<p class=\"rtejustify\">Know Square&nbsp;es una red de conocimiento formada por más de 6.000 directivos y profesionales independientes, cuya finalidad es compartir conocimiento, y experiencias relevantes para el desarrollo personal y la mejora de la gestión empresarial. Un punto de encuentro, on-line y presencial, en el que mediante encuentros, talleres, conferencias, informes… se promueve la participación, la colaboración y la interactividad de todos sus socios..</p>\n<p class=\"rtejustify\">Know Square organiza cada año los Premios que llevan su nombre, otorgando dos galardones:&nbsp;&nbsp;</p>\n<p class=\"rtejustify\">1.&nbsp;<strong>Premio al Mejor Libro de Empresa</strong>: se premia el mejor libro en materias vinculadas a la gestión empresarial, en sus diferentes vertientes, publicado en España.</p>\n<p class=\"rtejustify\"><strong>2. Premio a la Trayectoria Divulgativa Ejemplar</strong>: la&nbsp;finalidad es reconocer la trayectoria profesional, divulgativa o docente, de una institución o persona física. La elección, por lo tanto, no se basa en un trabajo&nbsp;o actividad&nbsp;concreto(s).&nbsp;El Premio se&nbsp;centra en candidatos profesionales o fundaciones o asociaciones que, por su labor, experiencia, conocimiento y aportaciones, se hayan convertido en autores o divulgadores de referencia,&nbsp;no solo&nbsp;en el mundo de la economía y la gestión empresarial, en sus diferentes vertientes,&nbsp;sino también en aquellos ámbitos en los que los directivos y empresarios se encuentran necesariamente inmersos —como consecuencia de los cambios constantes y acelerados que sufre la sociedad a la que sirven—, y que les sean de utilidad para su crecimiento personal y su gestión diaria, para que contribuyan así al desarrollo integral de su actividad.</p>\n<p class=\"rtejustify\">Algunos de los aspectos que se tienen en cuenta a la hora de otorgar este premio son biografía,&nbsp;experiencia, compromiso social, ideas innovadoras, espíritu humanista y la capacidad para divulgar.</p>\n<p class=\"rtejustify\">Los premiados han sido, por orden cronológico inverso, el Real Instituto Elcano, Adela Cortina, José Antonio Marina, Fundación Rafael del Pino, Mario Alonso Puig, Santiago Álvarez de Mon y Carlos Rodríguez Braun.</p>",
  "seo": {
    "title": "Asunción Gómez Pérez recibe el premio a la Trayectoria Divulgativa Ejemplar 2018 - Departamento de Inteligencia Artificial",
    "ogTitle": "Asunción Gómez Pérez recibe el premio a la Trayectoria Divulgativa Ejemplar 2018 - Departamento de Inteligencia Artificial",
    "ogType": "article",
    "image": "/assets/uploads/2019/04/Premiados-Know-Square-2019.jpeg",
    "publishedTime": "2019-04-29T15:47:08+00:00",
    "robots": "index, follow, max-image-preview:large, max-snippet:-1, max-video-preview:-1"
  },
  "wpId": 109
}
