{
  "slug": "nuevo-libro-de-los-catedraticos-de-la-upm-concha-bielza-y-pedro-larranaga",
  "title": "Nuevo libro de los catedráticos de la UPM, Concha Bielza y Pedro Larrañaga",
  "date": "2021-01-13T12:45:34+00:00",
  "modified": "2021-01-13T12:45:34+00:00",
  "author": "dia_admin",
  "categories": [
    "uncategorized"
  ],
  "tags": [
    "noticias"
  ],
  "image": {
    "src": "/assets/uploads/2021/01/libro_larranaga.jpeg",
    "width": 612,
    "height": 612,
    "alt": "libro_larranaga"
  },
  "thumbnail": {
    "src": "/assets/uploads/2021/01/libro_larranaga-400x250.jpeg",
    "width": 400,
    "height": 250,
    "alt": "libro_larranaga"
  },
  "readingTime": "1 minuto de lectura",
  "excerptHtml": "<p>El libro, publicado por la editorial Cambridge University Press introduce al lector en diferentes técnicas relacionadas con el machine learning y los modelos estadísticos aplicados</p>",
  "contentHtml": "<p><strong>El libro, publicado por la editorial Cambridge University Press introduce al lector en diferentes técnicas relacionadas con el machine learning y los modelos estadísticos aplicados a la neurociencia.</strong></p>\n<p>Los catedráticos de la ETSI Informática de la &nbsp;Universidad Politécnica de Madrid, Concha Bielza y Pedro Larrañaga han publicado un nuevo libro en el que recogen algunas de sus aportaciones más destacadas en materia de neurociencia computacional.</p>\n<p>El texto, que ha sido publicado por la prestigiosa editorial Cambridge University Press, resulta de especial interés para los jóvenes investigadores y graduados que quieran ampliar sus conocimientos en el campo del tratamiento de datos aplicado a la neurociencia. Cada una de las técnicas propuestas se acompaña de casos prácticos y casos reales que animan al lector a buscar sus propias soluciones al problema, aplicando los conocimientos que se le presentan.</p>\n<p>Centrado en la aplicación del machine learning y los modelos estadísticos al campo de la neurociencia, el texto abarca una gran cantidad de metodologías &nbsp;y ha recibido una muy buena acogida por parte de la comunidad científica.</p>\n<p><a href=\"https://www.cambridge.org/core/books/datadriven-computational-neuroscience/1D528620B04385EFBDDCBDD3F5C1C485#fndtn-information\">Más información</a></p>\n<p>&nbsp;</p>\n<p>&nbsp;</p>\n<p><a href=\"https://www.upm.es/e-politecnica/?p=11621\">Fuente</a></p>",
  "seo": {
    "title": "Nuevo libro de los catedráticos de la UPM, Concha Bielza y Pedro Larrañaga - Departamento de Inteligencia Artificial",
    "ogTitle": "Nuevo libro de los catedráticos de la UPM, Concha Bielza y Pedro Larrañaga - Departamento de Inteligencia Artificial",
    "ogType": "article",
    "image": "/assets/uploads/2021/01/libro_larranaga.jpeg",
    "publishedTime": "2021-01-13T12:45:34+00:00",
    "robots": "index, follow, max-image-preview:large, max-snippet:-1, max-video-preview:-1"
  },
  "wpId": 161
}
