{
  "slug": "publicacion-de-concha-bielza-y-pedro-larranaga-del-articulo-a-community-based-transcriptomics-classification-and-nomenclature-of-neocortical-cell-types-en-la-revista-nature-neuroscie",
  "title": "Publicación de Concha Bielza y Pedro Larrañaga del artículo “A community-based transcriptomics classification and nomenclature of neocortical cell types” en la revista Nature Neuroscience",
  "date": "2020-08-26T06:52:51+00:00",
  "modified": "2020-08-26T06:52:51+00:00",
  "author": "dia_admin",
  "categories": [
    "uncategorized"
  ],
  "tags": [
    "noticias",
    "top-stories"
  ],
  "image": {
    "src": "/assets/uploads/2020/08/conchaypedro1.png",
    "width": 1800,
    "height": 1200,
    "alt": "conchaypedro1"
  },
  "thumbnail": {
    "src": "/assets/uploads/2020/08/conchaypedro1-400x250.png",
    "width": 400,
    "height": 250,
    "alt": "conchaypedro1"
  },
  "readingTime": "1 minuto de lectura",
  "excerptHtml": "<p>Los catedráticos de la ETSIINF y directores del Computational Intelligence Group, Concha Bielza y Pedro Larrañaga, han participado en un proyecto dentro del &nbsp;grupo FENS</p>",
  "contentHtml": "<p>Los catedráticos de la ETSIINF y directores del Computational Intelligence Group, Concha Bielza y Pedro Larrañaga, han participado en un proyecto dentro del &nbsp;grupo FENS (Federation of European Neuroscience Societies) y la Federación Lundbeck The Brain Prize, con origen en la Conferencia: “The necessity of cell types for brain function” que tuvo lugar en Copenhague, del 7 al 10 de octubre de 2018.<br>\nComo resultado de dicho proyecto han &nbsp;publicado el artículo “A community-based transcriptomics classification and nomenclature of neocortical cell types” en la revista Nature Neuroscience (acceso abierto).<br>\nEl artículo está disponible en este <a href=\"https://www.nature.com/articles/s41593-020-0685-8.epdf?sharing_token=9cyq7Ui3tY41ySrrUgQLdtRgN0jAjWel9jnR3ZoTv0Mr7sD3Srdq0frO1sFEcL2OE65gn0rwl3Bmz6ldqgGwSc5Rbq84q_MoUxuLIy6PwL46xj1K5HzpQvrWNjOf54aO8N2kiBrsPYhxMllh-HeWuwEVM2n1f-4MdwufdWaALtI%3D\">enlace</a></p>",
  "seo": {
    "title": "Publicación de Concha Bielza y Pedro Larrañaga del artículo “A community-based transcriptomics classification and nomenclature of neocortical cell types” en la revista Nature Neuroscience - Departamento de Inteligencia Artificial",
    "ogTitle": "Publicación de Concha Bielza y Pedro Larrañaga del artículo “A community-based transcriptomics classification and nomenclature of neocortical cell types” en la revista Nature Neuroscience - Departamento de Inteligencia Artificial",
    "ogType": "article",
    "image": "/assets/uploads/2020/08/conchaypedro1.png",
    "publishedTime": "2020-08-26T06:52:51+00:00",
    "robots": "index, follow, max-image-preview:large, max-snippet:-1, max-video-preview:-1"
  },
  "wpId": 149
}
