{
  "slug": "los-profesores-de-la-etsiinf-concha-bielza-y-pedro-larranaga-participan-en-el-global-innovation-day-2019",
  "title": "Los profesores de la ETSIINF, Concha Bielza y Pedro Larrañaga, participan en el Global Innovation Day 2019",
  "date": "2019-11-11T12:52:34+00:00",
  "modified": "2019-11-11T12:52:34+00:00",
  "author": "ajimenez",
  "categories": [
    "uncategorized"
  ],
  "tags": [
    "noticias",
    "top-stories"
  ],
  "image": {
    "src": "/assets/uploads/2019/11/3930-0-Opera_Instantanea_2019_11_07_125107_mail.google.com-2.png",
    "width": 696,
    "height": 399,
    "alt": "3930-0-Opera_Instantanea_2019_11_07_125107_mail"
  },
  "thumbnail": {
    "src": "/assets/uploads/2019/11/3930-0-Opera_Instantanea_2019_11_07_125107_mail.google.com-2-400x250.png",
    "width": 400,
    "height": 250,
    "alt": "3930-0-Opera_Instantanea_2019_11_07_125107_mail"
  },
  "readingTime": "1 minuto de lectura",
  "excerptHtml": "<p class=\"rtejustify\">El pasado 4 de noviembre, los profesores de la ETSIINF, Concha Bielza y Pedro Larrañaga, participaron en el&nbsp;<a href=\"https://www.innobasque.eus/microsite/global-innovation-day-2019/\">Global Innovation Day 2019</a>&nbsp;que inauguraba la&nbsp;XIX Semana de la Ciencia, la Tecnología y la Innovación.</p>",
  "contentHtml": "<p class=\"rtejustify\">El pasado 4 de noviembre, los profesores de la ETSIINF, Concha Bielza y Pedro Larrañaga, participaron en el&nbsp;<a href=\"https://www.innobasque.eus/microsite/global-innovation-day-2019/\">Global Innovation Day 2019</a>&nbsp;que inauguraba la&nbsp;XIX Semana de la Ciencia, la Tecnología y la Innovación.</p>\n<p class=\"rtejustify\">El pasado 4 de noviembre, los profesores de la ETSIINF, Concha Bielza y Pedro Larrañaga, participaron en el&nbsp;<a href=\"https://www.innobasque.eus/microsite/global-innovation-day-2019/\">Global Innovation Day 2019</a>&nbsp;que inauguraba la&nbsp;XIX Semana de la Ciencia, la Tecnología y la Innovación.</p>\n<p class=\"rtejustify\">Su participación consistió en un diálogo&nbsp;que mantuvieron sobre inteligencia artificial, abordando las posibilidades que abre esta tecnología para la innovación disruptiva. Mostraron ejemplos exitosos de aplicación en diferentes ámbitos y plantearon algunos desafíos que la aplicación de la IA supone para la sociedad, desde el punto de vista ético, así como el futuro que la inteligencia artificial puede dibujar en fabricación avanzada, energía y biociencias/salud.</p>\n<p class=\"rtejustify\">La Semana de la Ciencia, Tecnología e Innovación es una iniciativa europea que en Euskadi se celebra desde hace 19 años. En esta edición, del 4 al 10 de noviembre, numerosas organizaciones llevan a cabo actividades divulgativas que acercan a toda la sociedad las capacidades científico-tecnológicas vascas, generando un entorno social proclive a la ciencia y la innovación, con el fin de profundizar en un modelo productivo y una sociedad basados en el conocimiento.</p>",
  "seo": {
    "title": "Los profesores de la ETSIINF, Concha Bielza y Pedro Larrañaga, participan en el Global Innovation Day 2019 - Departamento de Inteligencia Artificial",
    "ogTitle": "Los profesores de la ETSIINF, Concha Bielza y Pedro Larrañaga, participan en el Global Innovation Day 2019 - Departamento de Inteligencia Artificial",
    "ogType": "article",
    "image": "/assets/uploads/2019/11/3930-0-Opera_Instantanea_2019_11_07_125107_mail.google.com-2.png",
    "publishedTime": "2019-11-11T12:52:34+00:00",
    "robots": "index, follow, max-image-preview:large, max-snippet:-1, max-video-preview:-1"
  },
  "wpId": 117
}
