{
  "slug": "proyecto-de-reconocimiento-e-interaccion-visual-del-centro-ai-nnovation-space-en-el-hormiguero-antena-3",
  "title": "Proyecto de Reconocimiento e Interacción Visual del Centro AI.nnovation Space en El Hormiguero (Antena 3)",
  "date": "2019-02-27T11:38:46+00:00",
  "modified": "2019-02-27T11:38:46+00:00",
  "author": "ajimenez",
  "categories": [
    "uncategorized"
  ],
  "tags": [
    "noticias",
    "top-stories"
  ],
  "image": {
    "src": "/assets/uploads/2019/02/Captura-de-pantalla-2019-02-27-a-las-12.31.16.png",
    "width": 598,
    "height": 452,
    "alt": "Captura de pantalla 2019-02-27 a las 12"
  },
  "thumbnail": {
    "src": "/assets/uploads/2019/02/Captura-de-pantalla-2019-02-27-a-las-12.31.16-400x250.png",
    "width": 400,
    "height": 250,
    "alt": "Captura de pantalla 2019-02-27 a las 12"
  },
  "readingTime": "1 minuto de lectura",
  "excerptHtml": "<p>El proyecto de Reconocimiento e Interacción Visual desarrollado en el&nbsp;<a href=\"https://www.ainnovation.upm.es\" target=\"_blank\" rel=\"noopener\">Centro AI.nnovation Space</a>&nbsp;por ex alumnos del Máster U. en Inteligencia Artificial&nbsp;se ha presentado en el el programa El Hormiguero (Antena 3)</p>",
  "contentHtml": "<p>El proyecto de Reconocimiento e Interacción Visual desarrollado en el&nbsp;<a href=\"https://www.ainnovation.upm.es\" target=\"_blank\" rel=\"noopener\">Centro AI.nnovation Space</a>&nbsp;por ex alumnos del Máster U. en Inteligencia Artificial&nbsp;se ha presentado en el el programa El Hormiguero (Antena 3)</p>\n<p class=\"rtejustify\">El proyecto de Reconocimiento e Interacción Visual desarrollado en el&nbsp;<a href=\"https://www.ainnovation.upm.es\" target=\"_blank\" rel=\"noopener\">Centro tecnológico mixto UPM – Accenture «AI.nnovation Space»</a>&nbsp;por ex alumnos del MUIA&nbsp;se ha presentado en el el programa El Hormiguero (Antena 3)</p>\n<p>Los autores del proyecto son:&nbsp;Andrés Prados, Serge Chavez y Luis Baumela Molina (profesor del MUIA)</p>\n<p>El vídeo de la presentación está disponible en:</p>\n<p><a href=\"https://www.antena3.com/programas/el-hormiguero/secciones/ciencia-marron/marron-sorprende-avance-tecnologico-podria-cambiar-mundo_201902265c75b3400cf2acca9c2e11ea.html\" target=\"_blank\" rel=\"noopener\">https://www.antena3.com/programas/el-hormiguero/secciones/ciencia-marron/marron-sorprende-avance-tecnologico-podria-cambiar-mundo_201902265c75b3400cf2acca9c2e11ea.html</a></p>",
  "seo": {
    "title": "Proyecto de Reconocimiento e Interacción Visual del Centro AI.nnovation Space en El Hormiguero (Antena 3) - Departamento de Inteligencia Artificial",
    "ogTitle": "Proyecto de Reconocimiento e Interacción Visual del Centro AI.nnovation Space en El Hormiguero (Antena 3) - Departamento de Inteligencia Artificial",
    "ogType": "article",
    "image": "/assets/uploads/2019/02/Captura-de-pantalla-2019-02-27-a-las-12.31.16.png",
    "publishedTime": "2019-02-27T11:38:46+00:00",
    "robots": "index, follow, max-image-preview:large, max-snippet:-1, max-video-preview:-1"
  },
  "wpId": 103
}
