{
  "slug": "el-catedratico-del-departamento-victor-maojo-en-el-articulo-la-inteligencia-artificial-en-salud-se-abre-camino-en-espana-a-pesar-de-las-asimetrias-territoriales-de-acta-sanitaria",
  "title": "El catedrático del departamento, Víctor Maojo, en el artículo “La Inteligencia Artificial en salud se abre camino en España a pesar de las asimetrías territoriales” de Acta Sanitaria",
  "date": "2021-03-31T10:20:02+00:00",
  "modified": "2021-03-31T10:20:02+00:00",
  "author": "ajimenez",
  "categories": [
    "uncategorized"
  ],
  "tags": [
    "noticias"
  ],
  "image": {
    "src": "/assets/uploads/2021/03/Acta-sanitaria.png",
    "width": 644,
    "height": 442,
    "alt": "Acta sanitaria"
  },
  "thumbnail": {
    "src": "/assets/uploads/2021/03/Acta-sanitaria-400x250.png",
    "width": 400,
    "height": 250,
    "alt": "Acta sanitaria"
  },
  "readingTime": "1 minuto de lectura",
  "excerptHtml": "<p>Acta Sanitaria, en su&nbsp;artículo titulado “La Inteligencia Artificial en salud se abre camino en España a pesar de las asimetrías territoriales”, se hace eco del</p>",
  "contentHtml": "<p class=\"rtejustify\">Acta Sanitaria, en su&nbsp;artículo titulado “La Inteligencia Artificial en salud se abre camino en España a pesar de las asimetrías territoriales”, se hace eco del <a href=\"https://www.cofalicante.com/formacion/jornadas-externas/webinar-la-importancia-de-los-datos-y-la-inteligencia-artificial-en-la-transformacion-de-la-medicina-fundacion-bamberg/\" target=\"_blank\" rel=\"noopener\">Webimar</a> «La importancia de los datos y la Inteligencia Artificial en la Transformación de la Medicina» organizado por la Fundación Bamberg, en el que participó en el catedrático de nuestro departamento Víctor Maojo, que aparece en el citado artículo. El artículo está disponible en el siguiente <a href=\"https://www.actasanitaria.com/inteligencia-artificial-salud-abre-camino-espana/\" target=\"_blank\" rel=\"noopener\">enlace</a>.</p>",
  "seo": {
    "title": "El catedrático del departamento, Víctor Maojo, en el artículo “La Inteligencia Artificial en salud se abre camino en España a pesar de las asimetrías territoriales” de Acta Sanitaria - Departamento de Inteligencia Artificial",
    "ogTitle": "El catedrático del departamento, Víctor Maojo, en el artículo “La Inteligencia Artificial en salud se abre camino en España a pesar de las asimetrías territoriales” de Acta Sanitaria - Departamento de Inteligencia Artificial",
    "ogType": "article",
    "image": "/assets/uploads/2021/03/Acta-sanitaria.png",
    "publishedTime": "2021-03-31T10:20:02+00:00",
    "robots": "index, follow, max-image-preview:large, max-snippet:-1, max-video-preview:-1"
  },
  "wpId": 168
}
