{
  "slug": "pedro-larranaga-mugica-premio-de-incorporacion-de-excelencia-investigadora-de-la-upm-2019",
  "title": "Pedro Larrañaga Múgica, Premio de Incorporación de Excelencia Investigadora de la UPM 2019",
  "date": "2019-12-19T08:40:41+00:00",
  "modified": "2019-12-19T08:40:41+00:00",
  "author": "ajimenez",
  "categories": [
    "uncategorized"
  ],
  "tags": [
    "noticias",
    "top-stories"
  ],
  "image": {
    "src": "/assets/uploads/2019/12/Pedro_0_0_0.jpg",
    "width": 176,
    "height": 220,
    "alt": "Pedro_0_0"
  },
  "thumbnail": {
    "src": "/assets/uploads/2019/12/Pedro_0_0_0.jpg",
    "width": 176,
    "height": 220,
    "alt": "Pedro_0_0"
  },
  "readingTime": "1 minuto de lectura",
  "excerptHtml": "<p class=\"rtejustify\">Pedro Larrañaga Múgica, profesor del Máster U. en Inteligencia Artificial, ha recibido el Premio de Incorporación de Excelencia Investigadora de la Universidad Politécnica de Madrid&nbsp;2019.</p>",
  "contentHtml": "<p class=\"rtejustify\">Pedro Larrañaga Múgica, profesor del Máster U. en Inteligencia Artificial, ha recibido el Premio de Incorporación de Excelencia Investigadora de la Universidad Politécnica de Madrid&nbsp;2019.</p>\n<p class=\"rtejustify\">Pedro&nbsp;Larrañaga Múgica, Investigador Principal del&nbsp;<a href=\"http://cig.fi.upm.es\" target=\"_blank\" rel=\"noopener\">Computational Intelligence Group</a>&nbsp;y&nbsp;profesor del Máster U. en Inteligencia Artificial, ha recibido el Premio de Incorporación de Excelencia Investigadora de la Universidad Politécnica de Madrid&nbsp;2019.</p>\n<p class=\"rtejustify\">El premio reconoce al profesor en activo a tiempo completo de la UPM que más haya destacado en su vida profesional por su labor investigadora en cualquiera de las áreas de conocimiento de la Universidad. Este premio reconoce el talento de profesores que se incorporan a la UPM habiendo estado previamente vinculados a otra institución por un periodo de al menos 5 años como doctor.&nbsp;</p>",
  "seo": {
    "title": "Pedro Larrañaga Múgica, Premio de Incorporación de Excelencia Investigadora de la UPM 2019 - Departamento de Inteligencia Artificial",
    "ogTitle": "Pedro Larrañaga Múgica, Premio de Incorporación de Excelencia Investigadora de la UPM 2019 - Departamento de Inteligencia Artificial",
    "ogType": "article",
    "image": "/assets/uploads/2019/12/Pedro_0_0_0.jpg",
    "publishedTime": "2019-12-19T08:40:41+00:00",
    "robots": "index, follow, max-image-preview:large, max-snippet:-1, max-video-preview:-1"
  },
  "wpId": 121
}
