{
  "slug": "el-computational-intelligence-group-obtiene-una-de-las-5-ayudas-a-equipos-de-investigacion-cientifica-en-big-data-de-la-fundacion-bbva",
  "title": "El Computational Intelligence Group obtiene una de las 5 Ayudas a Equipos de Investigación Científica en Big Data de la Fundación BBVA",
  "date": "2020-03-30T14:09:59+00:00",
  "modified": "2020-03-30T14:09:59+00:00",
  "author": "ajimenez",
  "categories": [
    "uncategorized"
  ],
  "tags": [
    "noticias",
    "top-stories"
  ],
  "image": {
    "src": "/assets/uploads/2020/03/portada_ayudas_big_data_1600x650.jpg",
    "width": 1600,
    "height": 650,
    "alt": "portada_ayudas_big_data_1600x650"
  },
  "thumbnail": {
    "src": "/assets/uploads/2020/03/portada_ayudas_big_data_1600x650-400x250.jpg",
    "width": 400,
    "height": 250,
    "alt": "portada_ayudas_big_data_1600x650"
  },
  "readingTime": "1 minuto de lectura",
  "excerptHtml": "<p class=\"rtejustify\">La propuesta “<strong>Score-based nonstationary temporal Bayesian networks. Applications in climate and neuroscience</strong>» del&nbsp;Computational Intelligence Group obtiene&nbsp;una de las 5 Ayudas a Equipos de Investigación Científica en Big Data de la Fundación BBVA.</p>",
  "contentHtml": "<p class=\"rtejustify\">La propuesta “<strong>Score-based nonstationary temporal Bayesian networks. Applications in climate and neuroscience</strong>» del&nbsp;Computational Intelligence Group obtiene&nbsp;una de las 5 Ayudas a Equipos de Investigación Científica en Big Data de la Fundación BBVA.</p>\n<p class=\"rtejustify\">La comisión evaluadora de las Ayudas Fundación BBVA a Equipos de Investigación Científica en el área de Big Data, reunida por videoconferencia el día 24 marzo de 2020, y siguiendo los criterios establecidos en&nbsp; las&nbsp;<a href=\"https://www.fbbva.es/wp-content/uploads/2019/09/Bases_Ayudas_Equipos_Investigacion_Cientifica_2019.pdf\" rel=\"noopener\" target=\"_blank\">bases de la convocatoria</a>,&nbsp;publicadas en octubre de 2019, acordó la concesión de ayudas.</p>\n<p class=\"rtejustify\">Infornación sobre la propuesta del CIG seleccionada:</p>\n<p class=\"rtejustify\">“<strong>Score-based nonstationary temporal Bayesian networks. Applications in climate and neuroscience (BAYES-CLIMA-NEURO)</strong>”</p>\n<p class=\"rtejustify\">Investigador principal:&nbsp;Pedro Larrañaga Múgica,&nbsp;Departamento de Inteligencia Artificial,&nbsp;Universidad Politécnica de Madrid</p>\n<p class=\"rtejustify\">Miembros del equipo:&nbsp;Concha Bielza Lozoya (Universidad Politécnica de Madrid);&nbsp;Juan Antonio Fernández del Pozo de Salamanca (Universidad Politécnica de Madrid);&nbsp;Bojan Mihaljevic (Universidad Politécnica de Madrid);&nbsp;David Atienza González (Universidad Politécnica de Madrid); e Irene Córdoba Sánchez (Universidad Politécnica de Madrid).</p>\n<p class=\"rtejustify\">Importe de la ayuda: 100.000 euros.</p>\n<p class=\"rtejustify\"><a href=\"https://www.fbbva.es/noticias/concedidas-5-ayudas-a-equipos-de-investigacion-cientifica-en-big-data/\" target=\"_blank\" rel=\"noopener\">Más información</a></p>",
  "seo": {
    "title": "El Computational Intelligence Group obtiene una de las 5 Ayudas a Equipos de Investigación Científica en Big Data de la Fundación BBVA - Departamento de Inteligencia Artificial",
    "ogTitle": "El Computational Intelligence Group obtiene una de las 5 Ayudas a Equipos de Investigación Científica en Big Data de la Fundación BBVA - Departamento de Inteligencia Artificial",
    "ogType": "article",
    "image": "/assets/uploads/2020/03/portada_ayudas_big_data_1600x650.jpg",
    "publishedTime": "2020-03-30T14:09:59+00:00",
    "robots": "index, follow, max-image-preview:large, max-snippet:-1, max-video-preview:-1"
  },
  "wpId": 133
}
