{
  "slug": "abierto-periodo-de-preinscripcion-del-master-y-doctorado-en-inteligencia-artificial",
  "title": "Abierto periodo de preinscripción del Máster y Doctorado en Inteligencia Artificial",
  "date": "2017-06-01T09:15:53+00:00",
  "modified": "2017-06-01T09:15:53+00:00",
  "author": "noticias",
  "categories": [
    "uncategorized"
  ],
  "tags": [
    "noticias"
  ],
  "image": {
    "src": "/assets/uploads/2017/02/Imagen-Master.png",
    "width": 299,
    "height": 298,
    "alt": "Imagen Máster"
  },
  "thumbnail": {
    "src": "/assets/uploads/2017/02/Imagen-Master.png",
    "width": 251,
    "height": 250,
    "alt": "Imagen Máster"
  },
  "readingTime": "1 minuto de lectura",
  "excerptHtml": "<h3 class=\"rtejustify\">El periodo de preinscripción del <strong>Máster U. en Inteligencia Artificial</strong> es del 1 de Febrero al 9 de Julio de 2017.&nbsp;</h3>\n<h3 class=\"rtejustify\">El periodo de preinscripción del <strong>Doctorado&nbsp;en Inteligencia Artificial</strong> es del 16 de Enero al 30 de Abril de 2017.</h3>",
  "contentHtml": "<h3 class=\"rtejustify\">El periodo de preinscripción del <strong>Máster U. en Inteligencia Artificial</strong> es del 1 de Febrero al 9 de Julio de 2017.&nbsp;</h3>\n<h3 class=\"rtejustify\">El periodo de preinscripción del <strong>Doctorado&nbsp;en Inteligencia Artificial</strong> es del 16 de Enero al 30 de Abril de 2017.</h3>\n<p class=\"rtejustify\">El periodo de preinscripción del <strong>Máster U. en Inteligencia Artificial</strong> es del 1 de Febrero al 9 de Julio de 2017. Las listas de admitidos se publicarán en las siguientes fechas: 15 de marzo, 16 de mayo y 14 de julio de 2017.</p>\n<p class=\"rtejustify\">El periodo de preinscripción del <strong>Doctorado&nbsp;en Inteligencia Artificial</strong> es del 16 de Enero al 30 de Abril de 2017. Las fechas de publicación de admitidos están aún por determinar.</p>",
  "seo": {
    "title": "Abierto periodo de preinscripción del Máster y Doctorado en Inteligencia Artificial - Departamento de Inteligencia Artificial",
    "ogTitle": "Abierto periodo de preinscripción del Máster y Doctorado en Inteligencia Artificial - Departamento de Inteligencia Artificial",
    "ogType": "article",
    "image": "/assets/uploads/2017/02/Imagen-Master.png",
    "publishedTime": "2017-06-01T09:15:53+00:00",
    "robots": "index, follow, max-image-preview:large, max-snippet:-1, max-video-preview:-1"
  },
  "wpId": 45
}
